{"small_version":"2.0.0","project_id":"project_a89af76cb6a8d3fb5d3e29ac22a0c35d","receipt_id":"receipt_d7542d958683ba8011e07c307d806c90","strength":"narrative_assertion","availability":"verified","producer":{"tool":"small checkpoint"},"task_id":"task_4773bf3c83c7e364d9cde23722d1211a","task_revision":1,"policy_revision":"policy_6e0fa51f664cce0629cd586cac440476","source_digest":"c991b026d1e02dcb4710ce2e85279af13eba3ef49b36cd82a177f469749b51db","outcome":"completed","metadata":{"evidence":"Created src/resume-ready.txt through small apply and reviewed the captured command receipt.","notes":""},"digest":"869d2c9c7d44edcfd8c8524463b2710c5e3fedaf9d576428c2fc97246b0a443b"}
