{"small_version":"2.0.0","project_id":"project_a89af76cb6a8d3fb5d3e29ac22a0c35d","receipt_id":"receipt_c84d948b2d5d9c58a78303d1824b9dc0","strength":"cli_captured","availability":"verified","producer":{"command_sha256":"fef9f3d0eb39b1bba95a14429fc0542bd14510c97a647c86c27b1b902d629d8d","tool":"small apply"},"task_id":"task_4773bf3c83c7e364d9cde23722d1211a","task_revision":1,"policy_revision":"policy_6e0fa51f664cce0629cd586cac440476","source_digest":"fef9f3d0eb39b1bba95a14429fc0542bd14510c97a647c86c27b1b902d629d8d","outcome":"succeeded","metadata":{"bounded_output":"","exit_code":0,"output_truncated":false},"digest":"67e420009d2b49ec65f45d9ea93d06014a4090e4eb89add6232395b4e3ae12d8"}
